{"schema":"radar-laya-observations/1","corpus_sha256":"fe1deae63c5abd25b421131529f0c0ac613de6e42af0cacdc6fcb547ee66938b","questions_sha256":"a4ca15396c1b650ae5b4c9516e6ac5fe0ce40efe546686cfd7cdd2f4f2a73b76","source":{"kind":"synthetic-fixture","revision":"synthetic-v1","dtype":"fixture","model_revision":null,"model_sha256":null},"observations":[
{"case_id":"pt-01","status":"observed","probabilities":[0.91,0.03,0.03,0.03],"abstention":"passed","truncated":false},
{"case_id":"pt-02","status":"observed","probabilities":[0.03,0.91,0.03,0.03],"abstention":"passed","truncated":false},
{"case_id":"pt-03","status":"observed","probabilities":[0.25,0.25,0.25,0.25],"abstention":"passed","truncated":false},
{"case_id":"pt-04","status":"observed","probabilities":[0.03,0.03,0.03,0.91],"abstention":"passed","truncated":false},
{"case_id":"pt-05","status":"observed","probabilities":[0.03,0.91,0.03,0.03],"abstention":"passed","truncated":false},
{"case_id":"pt-06","status":"observed","probabilities":[0.91,0.03,0.03,0.03],"abstention":"passed","truncated":false},
{"case_id":"pt-07","status":"observed","probabilities":[0.91,0.03,0.03,0.03],"abstention":"passed","truncated":false},
{"case_id":"pt-08","status":"observed","probabilities":[0.91,0.03,0.03,0.03],"abstention":"passed","truncated":false},
{"case_id":"pt-09","status":"observed","probabilities":[0.03,0.91,0.03,0.03],"abstention":"passed","truncated":false},
{"case_id":"pt-10","status":"observed","probabilities":[0.03,0.03,0.91,0.03],"abstention":"abstained","truncated":false},
{"case_id":"pt-11","status":"observed","probabilities":[0.91,0.03,0.03,0.03],"abstention":"passed","truncated":false},
{"case_id":"pt-12","status":"observed","probabilities":[0.03,0.03,0.03,0.91],"abstention":"passed","truncated":true},
{"case_id":"pt-13","status":"observed","probabilities":[0.03,0.91,0.03,0.03],"abstention":"passed","truncated":false},
{"case_id":"pt-14","status":"not_run","probabilities":null,"abstention":"unevaluated","truncated":false},
{"case_id":"pt-15","status":"observed","probabilities":[0.03,0.91,0.03,0.03],"abstention":"unevaluated","truncated":false},
{"case_id":"pt-16","status":"observed","probabilities":[0.91,0.03,0.03,0.03],"abstention":"passed","truncated":false},
{"case_id":"pt-17","status":"observed","probabilities":[0.03,0.91,0.03,0.03],"abstention":"passed","truncated":false},
{"case_id":"pt-18","status":"observed","probabilities":[0.03,0.03,0.03,0.91],"abstention":"passed","truncated":false},
{"case_id":"pt-19","status":"observed","probabilities":[0.91,0.03,0.03,0.03],"abstention":"passed","truncated":false},
{"case_id":"pt-20","status":"observed","probabilities":[0.91,0.03,0.03,0.03],"abstention":"abstained","truncated":false},
{"case_id":"pt-21","status":"observed","probabilities":[0.91,0.03,0.03,0.03],"abstention":"passed","truncated":false},
{"case_id":"pt-22","status":"observed","probabilities":[0.03,0.91,0.03,0.03],"abstention":"passed","truncated":false},
{"case_id":"pt-23","status":"observed","probabilities":[0.03,0.91,0.03,0.03],"abstention":"passed","truncated":false},
{"case_id":"pt-24","status":"observed","probabilities":[0.91,0.03,0.03,0.03],"abstention":"passed","truncated":true}
]}
